
"78eef7e0-8b49-0130-f563-58d385a7bbd0",40754,"Claire Clairmont manuscript material","","Clairmont, Clara Mary Jane, 1798-1879",1814,1814,1879,"English","The manuscript material by Claire Clairmont in the Pforzheimer Collection consists of writings and correspondence. The writings include: two holograph journals kept during her travels with the Shelleys; holograph notes and essays prepared for E. J. Trelawny, relating to Shelley and Byron; and an effusive book inscription to Captain Edward Silsbee, the Shelley enthusiast. The bulk of the correspondence is from 1847-1856, and includes reflections on her experiences with Byron and the Shelleys, and various matters of family interest. Correspondents include: Lord Byron, English poet; Antonia Clairmont, her sister-in-law; Edward John Trelawny, the writer and adventurer; and over half a dozen others.","","","Clairmont, Clara Mary Jane, 1798-1879","","","","text","","b16544512","","Pforz MS","","","","","","","63 items","","","",1,"http://digitalcollections.nypl.org/collections/78eef7e0-8b49-0130-f563-58d385a7bbd0"
"195462f0-8feb-0130-e172-58d385a7b928",40756,"Paul et Virginie","","Saint-Pierre, Bernardin de, 1737-1814 | Thouvenin, Joseph, 1791-1834 | Didot, Pierre, 1761-1853","1806",1806,"","French","","General Note: ""Liste des souscripteurs de cette édition,"" [6] p. at end.","Engraving, French | Engraving | Drawings | Charcoal drawings | Ink drawings","","France","18th century | 19th century","","still image | text","Literature | novels | illustrated books","b16833647","","Spencer Coll. French 1806++","","","","","","131737939","[4], xcii, 194, [6] p., plates : port., ill. (some col.) ; 51 cm.","","Impr. de P. Didot l'aîné","Paris",1,"http://digitalcollections.nypl.org/collections/195462f0-8feb-0130-e172-58d385a7b928"
"026347d0-964d-0130-f782-58d385a7bbd0",40764,"The enormous room","","Cummings, E. E. (Edward Estlin), 1894-1962 | Cudlip, William B., 1904-1988 | Boni & Liveright","1922",1922,"","English","","Note: Berg Coll. copy contains bookseller's label: ""Dennen's Book Shop, 37 E. Grand River Ave., Detroit, Michigan""--free endpaper.","World War, 1914-1918","","","","","text","Books","b14429082","","Berg Coll Cummings E56 1922","","","","","","","[3], vii, 9-271 p. ; 21 cm.","","Boni and Liveright","New York",1,"http://digitalcollections.nypl.org/collections/026347d0-964d-0130-f782-58d385a7bbd0"
"adaf3fc0-9887-0130-20d0-58d385a7bbd0",40765,"Architecture","","",1900,1900,1936,"English","","General Note: Monthly","Architecture","","","","","text | still image","Periodicals","b14064229","","3-MQA+ (Architecture)|","","","","","","1481875","v. ill., plates (part col.) plans, diagrs. 31-34 cm.","","C. Scribner's Sons [etc.]","New York",12,"http://digitalcollections.nypl.org/collections/adaf3fc0-9887-0130-20d0-58d385a7bbd0"
"a123ed80-9a3f-0130-3e73-58d385a7b928",40768,"Billy Rose Theatre Division posters","","","","","","","","","","","","","","still image","Posters","","","","","","","","","","","","","",5,"http://digitalcollections.nypl.org/collections/a123ed80-9a3f-0130-3e73-58d385a7b928"
"7afd6830-9bae-0130-4c40-58d385a7bbd0",40770,"Vancenza, or The dangers of credulity","Vancenza, or The dangers of credulity","Robinson, Mary, 1758-1800 | Tegg, Thomas, 1776-1845","1810",1810,"","English","Elvira's plans to marry the Prince are ruined when she discovers that she is his half-sister.","","Incest","","","","","text","Gothic fiction (Literary genre), English","b19320841","","Pforz (Gothic novellas) V 6","","","","","","","[5]-28 p., [2] leaves of plates : ill. ; 18 cm.","","Published by T. Tegg, 111, Cheapside","London",1,"http://digitalcollections.nypl.org/collections/7afd6830-9bae-0130-4c40-58d385a7bbd0"
"8f013d40-a528-0130-974e-58d385a7bbd0",40784,"Frank H. Pierce papers relating to the U.S.S. Monitor","","Pierce, Frank H. (Frank Hutches), 1931- | Monitor (Ironclad)",1862,1862,1900,"English","The collection consists of correspondence between Frank H. Pierce and others, a scrapbook, and a muster roll documenting the history and construction of the ironclad U.S.S. Monitor, its commander and crew, and its loss during the Battle of Hampton Roads against the C.S.S. Virginia (also known as the Merrimack or Merrimac) in 1862.","Biographical or Historical Data Note: Frank H. Pierce was a book collector and historian from Mount Carmel, Connecticut.","History | Naval operations","Monitor (Ironclad)","United States","Civil War, 1861-1865","","text","muster rolls | Scrapbooks","b19822886","","MssCol 2424","","","","","","","1.02 linear feet (3 boxes, 1 oversized folder)","","","",1,"http://digitalcollections.nypl.org/collections/8f013d40-a528-0130-974e-58d385a7bbd0"
"8f589e80-ae8e-0130-3a75-58d385a7b928",40792,"La relacion que dio Aluar nuñez cabeça de vaca de lo acaescido enlas Jndias enla armada donde yua por gouernador Pãphilo de narbaez, desde el año de veynte y siete hasta el año d'treynta y seys que boluio a Seuilla con tres de su compañia.","La relacion que dio Aluar nuñez cabeça de vaca de lo acaescido enlas Jndias enla armada donde yua por gouernador Pãphilo de narbaez, desde el año de veynte y siete hasta el año d'treynta y seys que boluio a Seuilla con tres de su compañia.","Núñez Cabeza de Vaca, Alvar, 16th cent.","1542",1542,"","Spanish","","Citation/References Note: Harrisse BAV 239","","","","","","text","Books","b14369801","","*KB 1542 (Núñez Cabeza de Vaca, A. Relacion que dio Aluar nuñez cabeça de vaca de lo acaescido enlas Jndias)","","","","","","","68 l. 19 cm. (4to.)","","Impresso por Augustin de paz y Juan Picardo, a costa de Juan pedro musetti mercader de libros, vezino de Medina del campo","Zamora",1,"http://digitalcollections.nypl.org/collections/8f589e80-ae8e-0130-3a75-58d385a7b928"
"94faf940-aeb7-0130-cd58-58d385a7b928",40794,"The book of hours of the Emperor Maximilian the First. Decorated by Albrecht Dürer ... and other artists [and] printed in 1513 by Johannes Schoensperger at Augsburg. Edited and with a detailed commentary by Walter L. Strauss","","Maximilian I, Holy Roman Emperor, 1459-1519 | Dürer, Albrecht, 1471-1528 | Strauss, Walter L.","1974",1974,"","Latin | English","This ed. consists of a reproduction of the 62 folios in the Staatsbibliothek, Munich, and the 57 folios preserved at the Bibliotheque Municipale, Besançon, with the lacking signatures substituted from the undecorated copy of the Prayer Book at the Oesterreichische Nationalbibliothek, Vienna.","Language Note: In Latin, with marginal translations and notes in English.","Books of hours | Illumination of books and manuscripts, German","","","","","text | still image","Reproduction","b10192779","","MDTD+ 74-2165","0913870013","","","","","","v, 344 p. illus. 31 cm.","","Abaris Books","New York",1,"http://digitalcollections.nypl.org/collections/94faf940-aeb7-0130-cd58-58d385a7b928"
"7334faa0-af74-0130-1b57-58d385a7b928",40798,"Randzeichnungen zu Goethe's Balladen und Romanzen","","Neureuther, Eugen Napoleon, 1806-1882 | Goethe, Johann Wolfgang von, 1749-1832",1829,1829,1839,"","","Note: Illustrated title pages.","","","","","","","Illustrations","b14017686","","MEM+ (Neureuther)(Neureuther, E. N. Randzeichnungen zu Goethe's Balladen und Romanzen)","","","","","","","5 v. in 1. : ill. ; 38 cm.","Marginal illustrations | Drawings","Cotta","München",1,"http://digitalcollections.nypl.org/collections/7334faa0-af74-0130-1b57-58d385a7b928"
"93022bb0-b0ec-0130-5e1d-58d385a7bbd0",40800,"Leaves of grass","","Whitman, Walt, 1819-1892","1860",1860,"","English","","Reproduction Note: ""Electrotyped at the Boston stereotype foundry. Printed by George C. Rand & Avery"" on verso of title-page.","","","","","","text","Books","","","[uncatalogued]","","","","","","","456 p. : port. ; 20 cm.","","Thayer and Eldridg","Boston",2,"http://digitalcollections.nypl.org/collections/93022bb0-b0ec-0130-5e1d-58d385a7bbd0"
"f4854310-b1da-0130-aec1-58d385a7b928",40803,"The penny magazine of the society for the diffusion of useful knowledge","","American Society for the Diffusion of Useful Knowledge",1832,1832,1845,"English","","General Note: Weekly.","","","","","","text | still image","Periodicals","b15083401","","*DA (Penny Magazine of the Society for the Diffusion of Useful Knowledge)","","","","","","","v. : ill. ; 20-29 cm.","","J. S. Redfield, Clinton Hall","New York",1,"http://digitalcollections.nypl.org/collections/f4854310-b1da-0130-aec1-58d385a7b928"
"acfa2030-b4e3-0130-d490-58d385a7b928",40805,"The waste land","","Eliot, T. S. (Thomas Stearns), 1888-1965 | Bonner, Paul Hyde","1922",1922,"","English","","Ownership and Custodial History Note: Paul Hyde Bonner bookplate.","","","","","","text","Poetry","b10340826","","Berg Coll 76-574","","","","","","NYPG774153806-B","64 p. 20 cm.","","Boni and Liveright","New York",1,"http://digitalcollections.nypl.org/collections/acfa2030-b4e3-0130-d490-58d385a7b928"
"1c046ad0-b669-0130-32bb-58d385a7bbd0",40813,"Free, and other stories","","Dreiser, Theodore, 1871-1945","1918",1918,"","English","","General Note: Free -- McEwen of the shining slave makers -- Nigger Jeff -- The lost Phoebe -- The second choice -- A story of stories -- Old Rogaum and his Theresa -- Will you walk into my parlor -- The cruise of the Idlewild -- Married -- When the old century was new.","","","","","","","Books","","","Berg Coll","","","","","","","[3 p.l., 9-369 p.] ; 19.5 cm.","","Boni and Liveright","New York",2,"http://digitalcollections.nypl.org/collections/1c046ad0-b669-0130-32bb-58d385a7bbd0"
"71e70b20-b732-0130-39cb-58d385a7bbd0",40816,"Cosmographiae Introdvctio / Cvm Qvibvsdam / Geometriae / Ac / Astrono / miae Principiis / Ad Eam Dem [sic] Necessariis. / Insuper quatuor Americi Vespucii / nauigationes.","Cosmographiae Introdvctio / Cvm Qvibvsdam / Geometriae / Ac / Astrono / miae Principiis / Ad Eam Dem [sic] Necessariis. / Insuper quatuor Americi Vespucii / nauigationes.","Waldseemüller, Martin, 1470-1519 | Boulengier, Louis | Ringmann, Matthias, 1481 or 2-1510 | America -- Name","1517",1517,"","Latin","","General Note: Title and 8 lines of verse: Cosmographiae Introdvctio / Cvm Qvibvsdam / Geometriae / Ac / Astrono / miae Principiis / Ad Eam Dem [sic] Necessariis. / Insuper quatuor Americi Vespucii / nauigationes. / Vniuersalis Chosmographiæ [sic] descriptio / tam in solido q[uam] plano/ eis etiam / insertis quæ Ptholomæo / ignota a nuperis / reperta sunt. / Ad Dominvm Iacobvm. / Robertetvm./","Geography","America -- Name","","","","still image","Engraving","b14353394","","*KB 1517 (Waldseemüller, M. Cosmographiae Introdvctio / Cvm Qvibvsdam / Geometriae)","","","","","","","33 l. diagrs. (1 fold.) 20 cm. (4to.).","","Jean de La Place","Lyons",3,"http://digitalcollections.nypl.org/collections/71e70b20-b732-0130-39cb-58d385a7bbd0"
"f5d50150-bb21-0130-771a-58d385a7b928",40820,"Sir Walter Scott collection of papers 1796-1931 bulk (1797-1837)","","Scott, Walter, Sir, 1771-1832",1796,1796,1931,"","This is a synthetic collection that includes manuscripts, notebooks, letters, portraits of Scott, and drawings for his books, as well as legal and financial documents. It also contains original water color drawings by T. Stothard and John Masey Wright for Scott's novels. Also included are two notebooks of Richard Harris Barham and a commonplace book of S. S. Hazlitt, both of which include poems by Scott.","Date Note: The bulk of the collection was created between 1797-1837","","Scott, Walter, Sir, 1771-1832","","","","text | still image","","b15849935","","Berg Coll MSS Scott","","","","","","","55 items.","","","",4,"http://digitalcollections.nypl.org/collections/f5d50150-bb21-0130-771a-58d385a7b928"
"07a7b130-bcae-0130-6ce5-58d385a7b928",40822,"TheCurtiss Wright-er; about the Buffalo plant production soldiers.","","Curtiss-Wright Corporation",1941,1941,1945,"English","","Note: Library has: Vol. 1, no. 52 (July 8, 1945)-v. 4, no. 52 (June 28, 1945) (incomplete).","Employees' magazines, newsletters, etc. | Aircraft industry--Periodicals","","","","","text | still image","Periodicals","b11882230","","TLNA+ (Curtis Wright-er)","","","","","","","v. illus. 44 cm.","","Curtiss-Wright Corporation, Airplane Division","Buffalo, N.Y. [etc.]",2,"http://digitalcollections.nypl.org/collections/07a7b130-bcae-0130-6ce5-58d385a7b928"
"da603540-c0b4-0130-154c-58d385a7b928",40823,"Eleanora Mendelssohn papers","","Mendelssohn, Eleonora von",1880,1880,1949,"German | English | Italian | French","Eleonora von Mendelssohn was a German stage actress who emigrated to America at the time of Hitler's rise to power. She was actively involved in aiding other emigres and had much contact with the German acting community in Hollywood and New York. The collection includes personal and business papers and memorabilia of Eleonora von Mendelssohn and family members dating from 1880-1949. Papers reveal aspects of Mendelssohn's life, as well as problems, concerns and political tenor of the German emigre community in the United States during this period.","","","","","","","still image | text","Photographic prints | Sketches | scripts","b11883969","","MssCol 1963","","","","","","","","","","",1,"http://digitalcollections.nypl.org/collections/da603540-c0b4-0130-154c-58d385a7b928"
"cdecb450-c23a-0130-a81b-58d385a7bbd0",40831,"Overseas woman","","United States. Army. European Theater of Operations. Information and Education Division",1945,1945,1946,"English","","Note: Description based on: v. 1., no. 2 (May 1945); title from cover.","World War, 1939-1945--Participation, Female","","United States. Army. Women's Army Corps | United States--Armed Forces--Women","","","text | still image","Periodicals","b15436349","","BZAA O985 (Overseas woman)","","","","","","","v. ; 23 cm.","Periodical illustrations","Information and Education Division ETOUSA","APO 887",2,"http://digitalcollections.nypl.org/collections/cdecb450-c23a-0130-a81b-58d385a7bbd0"
"60525000-ca18-0130-7221-58d385a7bbd0",40851,"National research project on reemployment opportunities and recent changes in industrial techniques.","National research project on reemployment opportunities and recent changes in industrial techniques. [Report G]","United States. Works Progress Administration",1937,1937,1940,"English","","Note: No more published.","","","","","","","","b12382849","","TDV (United States. Works Progress Administration. National research project on reemployment opportunities and recent changes in industrial techniques. [Report G])","","","","","","","7 nos. charts, illus., tables. 26 cm.","","","Philadelphia, etc.",1,"http://digitalcollections.nypl.org/collections/60525000-ca18-0130-7221-58d385a7bbd0"
"b2be46b0-cb9b-0130-b79f-58d385a7bbd0",40853,"Documents","","New York County (N.Y.). Board of Supervisors",1857,1857,1874,"","","General Note: 1857-1863 included in its Proceedings; Financial documents, 1873/74 issued separately.","","","","","","","","b12336285","","*SYA (New York (County). Supervisors Board. Documents) Library has: 1856, no. 2-1870, no. 11 (incomplete)","","","","","","","","","","New York",1,"http://digitalcollections.nypl.org/collections/b2be46b0-cb9b-0130-b79f-58d385a7bbd0"
"6c64dfa0-d2e0-0130-a94f-58d385a7bbd0",40862,"Marya Freund papers relating to Arnold Schoenberg","Marya Freund papers relating to Arnold Schoenberg","Freund, Marya, 1876-1966 | Schoenberg, Arnold, 1874-1951",1912,1912,1966,"","","Date Note: The bulk of the collection was created 1912-1937.","","Freund, Marya, 1876-1966 | Schoenberg, Arnold, 1874-1951","","","","text","Archival materials | Correspondence | Programs | Leaflets | notebooks | Photographs","b11652199","","JOB 91-30","","","","","","","1.66 linear ft. (6 boxes)","","","",3,"http://digitalcollections.nypl.org/collections/6c64dfa0-d2e0-0130-a94f-58d385a7bbd0"
"4a455820-d761-0130-968a-58d385a7bbd0",40868,"Billy Rose Theatre Division book file","","","","","","","","","","","","","","","","","","","","","","","","","","","","",1,"http://digitalcollections.nypl.org/collections/4a455820-d761-0130-968a-58d385a7bbd0"
"6a016ad0-dc45-0130-12fb-58d385a7b928",40871,"Annual report of the American Type Founders' Company","","American Type Founders Company | American Type Founders Company -- Periodicals",1893,1893,1950,"English","","Note: Description based on: 2nd (1894).","Type and type-founding--United States","American Type Founders Company -- Periodicals","","","","","annual reports","b15476423","","*IPV (American Type Founders, inc. Annual report)","","","","","","","v. ; 25 cm.","","The Company","Jersey City, N.J.",2,"http://digitalcollections.nypl.org/collections/6a016ad0-dc45-0130-12fb-58d385a7b928"
"3effd3b0-dd15-0130-c112-58d385a7b928",40873,"Lestrente-six vues de la tour Eiffel","Les trente-six vues de la tour Eiffel, par Henri Rivière; prologue d'Arsène Alexandre.","Rivière, Henri, 1864-1951 | Alexandre, Arsène, 1859-1937","1902",1902,"","French","","Note: With autograph of the artist.","Eiffel Tower (Paris, France)","","","","","","","b13999405","","MEM+ R625rt (Rivière, H. Trente-six vues de la tour Eiffel)","","","","","","","2 p.l., v, 1 l., 36 pl., 2 l. 8vo.","Lithographs","E. Verneau","Paris",1,"http://digitalcollections.nypl.org/collections/3effd3b0-dd15-0130-c112-58d385a7b928"
"111ce000-f2f6-0130-47ae-58d385a7b928",40889,"Tracts on Romanism","","",1800,1800,1899,"English","","Note: Reissue of various tracts.","","Catholic Church -- Antiquities","","","","text","Books","b13491940","","ZMY (American Tract Society, New York. Tracts on Romanism)","","","","","","","11 parts in 1 v. illus. 19 cm.","","Amer. Tract Soc.","New York",1,"http://digitalcollections.nypl.org/collections/111ce000-f2f6-0130-47ae-58d385a7b928"
"0d0ad4c0-0440-0131-2f9b-58d385a7b928",40911,"The VVhole Booke Of Psalmes Faithfully Translated into English Metre. Whereunto is prefixed a discourse declaring not only the lawfullnes, but also the necessity of the heavenly ordinance of singing Scripture Psalmes in the Churches of God ...","The VVhole Booke Of Psalmes Faithfully Translated into English Metre. Whereunto is prefixed a discourse declaring not only the lawfullnes, but also the necessity of the heavenly ordinance of singing Scripture Psalmes in the Churches of God ...","Cotton, John, 1584-1652 | Mather, Richard, 1596-1669 | Eliot, John, 1604-1690 | Weld, Thomas, 1590?-1662","1640",1640,"","English","","Citation/References Note: Sabin 66428","Bible O.T.: Psalms, Metrical | Bay Psalm book, 1640","","","","","text","Bibles","b14483518","","*KD 1640 (Bible. Old Testament: Psalms. VVhole Booke Of Psalmes)","","","","","","","148 l. 18.5 cm. (8vo.).","","S. Day","Cambridge, Mass.",7,"http://digitalcollections.nypl.org/collections/0d0ad4c0-0440-0131-2f9b-58d385a7b928"
"f856a3c0-0768-0131-347a-58d385a7bbd0",40915,"TheHistory of America ...","TheHistory of America. Illustrated with portraits, maps, and plans.","Robertson, William, 1721-1793",1778,1778,1779,"English","","Ownership and Custodial History Note: Book-plate of Rich'd Bull.","","","","","","","","b14589542","","*KZ 8219-8445 (Robertson, W. History of America)","","","","","","","4 v. 4to.","","W. Strahan T. Cadell","London",4,"http://digitalcollections.nypl.org/collections/f856a3c0-0768-0131-347a-58d385a7bbd0"
"23636ca0-076d-0131-793e-58d385a7b928",40916,"TheHistory and Antiquities of London.","","Pennant, Thomas, 1726-1798","1814",1814,"","","","Note: v. 2-4 have title: Mr. Pennant's History of London, Westminster, and Southwark ...","England--Description and travel","","London (England)","","","","","b14602067","","*KZ 32152-33311 (Pennant, T. History and antiquities of London)","","","","","","","4 v. 55 cm.","","E. Jeffrey","London",1,"http://digitalcollections.nypl.org/collections/23636ca0-076d-0131-793e-58d385a7b928"
"ddc3e8e0-0cf4-0131-9276-58d385a7b928",40925,"Chim-Chim; folk stories from Jamaica","","Smith, Pamela Colman","1905",1905,"","","","","Folklore -- Jamaica","","","","","","","b11663870","","Sc 398-S (Smith, P. Chim-Chim)","","","","","","","","","The Green Sheaf","London",1,"http://digitalcollections.nypl.org/collections/ddc3e8e0-0cf4-0131-9276-58d385a7b928"
"33fc5300-0cff-0131-64bb-58d385a7bbd0",40933,"Universal Negro Improvement Association miscellaneous collection.","","Universal Negro Improvement Association",1918,1918,1948,"","","","","","","","","mixed material","","b18155599","","Sc MG 442","","","","","","","","","","",1,"http://digitalcollections.nypl.org/collections/33fc5300-0cff-0131-64bb-58d385a7bbd0"
"372054f0-0d04-0131-4b3f-58d385a7b928",40934,"Thegreat ""trunk mystery"" of New York City; murder of the beautiful Miss Alice A. Bowlsby, of Paterson, N.J. ...","","Rosenzweig, Jacob, b. 1831 or 2 | Bowlsby, Alice Augusta, d. 1871","1872",1872,"","English","","Note: Lettered on cover: Trial of Rosenzweig.","Trials (Murder)","Bowlsby, Alice Augusta, d. 1871","","","","","","b14347794","","SLN p.v. 19, no. 3","","","","","","","87 p. front. illus., por., plan.","","Barclay","Philadelphia",2,"http://digitalcollections.nypl.org/collections/372054f0-0d04-0131-4b3f-58d385a7b928"
"aa18cd70-0d99-0131-bfae-3c075448cc4b",40939,"General Collection","","","","","","","","","Dance","","","","","moving image","Filmed dance | Motion pictures | Video recording | moving images","","","","","","","","","","","","","",6,"http://digitalcollections.nypl.org/collections/aa18cd70-0d99-0131-bfae-3c075448cc4b"
"8b8e68c0-1eea-0131-e81c-58d385a7bbd0",40966,"Miscellaneous manuscripts","","","","","","","","","","","","","","","","","","","","","","","","","","","","",1,"http://digitalcollections.nypl.org/collections/8b8e68c0-1eea-0131-e81c-58d385a7bbd0"
"dec972d0-23af-0131-2af4-58d385a7bbd0",40971,"Trow business directory of the boroughs of Manhattan and the Bronx, city of New York","Trow's business directory of the boroughs of Manhattan and the Bronx, city of New York 1898-1902","Trow City Directory Company",1848,1848,1909,"English","","Reproduction Note: Microfilm. 1848-1909:[Gaps]. New York : New York Public Library, 1992. 20 microfilm reels ; 35 mm. (MN *ZZAN-20237).","Commerce","","New York (N.Y.) | Manhattan (New York, N.Y.) | Bronx (New York, N.Y.)","","","text","Directories","b11750502","","IZ (New York. New York City.) Directory","","","","","","","v.19 cm","","Trow directory, Printing and Bookbinding Co.","New York",2,"http://digitalcollections.nypl.org/collections/dec972d0-23af-0131-2af4-58d385a7bbd0"
"6d06fbe0-27a3-0131-57dd-58d385a7b928",40975,"Sefer Lida","","Manor, Alexander","1970",1970,"","Hebrew","","Language Note: Partly in Yiddish.","Jews, Belarusian | Jews | Belarus | Lida | Yeshivas | Zionism","","","","","text","Memorial books (Holocaust)","b13925128","","*P (Yizkor books. Reprint. Lida)","","","","","","","438, xvii p. : ill., facsims., maps, ports. ; 31 cm.","","Irgun yotse Lida be-Yiśraʼel u-Ṿaʻad ha-ʻezrah li-Yehude Lida be-Artsot ha-Berit","Tel Aviv",1,"http://digitalcollections.nypl.org/collections/6d06fbe0-27a3-0131-57dd-58d385a7b928"
"9d7c5240-2a14-0131-988d-58d385a7bbd0",40981,"Jewish American Cookbooks","","","","","","","","","Jewish cooking","","","","","text","Community cookbooks","","","","","","","","","","","","","",6,"http://digitalcollections.nypl.org/collections/9d7c5240-2a14-0131-988d-58d385a7bbd0"
"c22e3530-305d-0131-8a9d-58d385a7bbd0",40988,"Loie Fuller papers","","Fuller, Loie, 1862-1928",1892,1892,1913,"","","Note: Most of the autobiographical material published in Paris under title, Quinze ans de ma vie, F. Juven, 1908, and in London under title, Fifteen years of a dancer's life, H. Jenkins, 1913.","","","","","","","autobiography | writings","b12176972","","(S) *MGZMC-Res. 5","","","","","","","47 folders (679 items), 1 slipcase (25 items)","","","",1,"http://digitalcollections.nypl.org/collections/c22e3530-305d-0131-8a9d-58d385a7bbd0"
"d1b32720-3433-0131-2050-58d385a7b928",40992,"The whirlpool","","Gissing, George, 1857-1903","1897",1897,"","English","","Note: Publisher's ads 14 and [2] p. at end, dated November 1896.","","","","","","text","Books","b13166527","","NCW (Gissing, G. R. Whirlpool. London, 1897)","","","","","","","[5], 2-453, [4], 2-14, [2] p. ; 20 cm","","Lawrence and Bullen","London",1,"http://digitalcollections.nypl.org/collections/d1b32720-3433-0131-2050-58d385a7b928"
