"bbec4410-c5fb-012f-2417-58d385a7bc34",25889,"A collection of the dresses of different nations, antient [sic] and modern. Particularly old English dresses; after the designs of Holbein, Vandyke, Hollar and others, with an account of the authorities from which the figures are taken, and some short historical remarks on the subject. To which are added the habits of the principal characters on the English stage.","collection of the dresses of different nations, antient [sic] and modern. Particularly old English dresses; after the designs of Holbein, Vandyke, Hollar and others, with an account of the authorities from which the figures are taken, and some short historical remarks on the subject. To which are added the habits of the principal characters on the English stage.","",1757,1757,1772,"","","","Clothing & dress","","","","","still image","Prints | Books","b14140320","","MMC+ (Collection of the dresses of different nations)","","","","","","","4 v. 480 col. plates. 34 cm.","Engravings","T. Jefferys","London",492,"http://digitalcollections.nypl.org/collections/bbec4410-c5fb-012f-2417-58d385a7bc34"
"ed948d00-c5fb-012f-238b-58d385a7bc34",25890,"The people of India : A series of photographic illustrations, with  descriptive letterpress, of the races and tribes of Hindustan, originally prepared under the authority of the government of India, and reproduced  ...","","Watson, J. Forbes (John Forbes) (1827-1892) | Kaye, John William, Sir (1814-1876) | India Museum",1868,1868,1875,"","","Statement of Responsibility Note: ed. by J. Forbes Watson and John William Kaye.","Indigenous peoples | Manners & customs","","India","","","still image","Photographs | Books","b13409080","","MFY+ 01-9004","","","","","","2675501","8 v. mounted photos. 35 cm.","Albumen prints","India Museum","London",486,"http://digitalcollections.nypl.org/collections/ed948d00-c5fb-012f-238b-58d385a7bc34"
"86ffb4f0-c5fd-012f-d690-58d385a7bc34",25896,"Jerome Robbins Dance Division Photograph files","","","","","","","","","","","","","","still image","Photographs","","","","","","","","","","","","","",9,"http://digitalcollections.nypl.org/collections/86ffb4f0-c5fd-012f-d690-58d385a7bc34"
"46ad2ae0-c5fe-012f-66d0-58d385a7bc34",25899,"Allgemeine Naturgeschichte der Fische. French = Ichtylogie, ou Histoire naturelle : generale et particuliere  des poissons","","Bloch, Marcus Elieser (1723-1799) | Laveaux, J.-Charles (Jean-Charles) (1749-1827)",1785,1785,1797,"French","","Statement of Responsibility Note: par Marc Elieser Bloch.","Fish","","","","","still image","Books | Prints","b13637086","","VRE+++ (Bloch, M. E. Ichtylogie)","","","","","","32042314","12 pts. in 6 v. : ccccxxxii col. pl. ; 49 x 29 cm.","","chez l'auteur; [etc., etc.,]","Berlin",456,"http://digitalcollections.nypl.org/collections/46ad2ae0-c5fe-012f-66d0-58d385a7bc34"
"9a41dd30-c5fe-012f-dd13-58d385a7bc34",25900,"Sheet music of songs from various musicals, plays, movies, and television.","","","","","","","","","","","","","","notated music","Sheet music","","","","","","","","","","","","","",15,"http://digitalcollections.nypl.org/collections/9a41dd30-c5fe-012f-dd13-58d385a7bc34"
"e2b08120-c5fe-012f-5feb-58d385a7bc34",25901,"Voyage de la corvette l'Astrolabe exécuté par ordre du roi, pendant les années 1826-1827-1828-1829, sous le commandement de  M. J. Dumont d'Urville ...","","Dumont d'Urville, Jules-Sébastien-César (1790-1842)","1833",1833,"","French","","","","","","","","still image","Books | Prints | Maps","b13624459","","PQN+++ (Dumont d'Urville, J. S. C. Voyage de la corvette l'Astrolabe)","","","","","","38929520","atlas (6 v.) of diagr., maps, pl. (part col''d), port., fol.","","J. Tastu","Paris",452,"http://digitalcollections.nypl.org/collections/e2b08120-c5fe-012f-5feb-58d385a7bc34"
"3f487530-c602-012f-f6c0-58d385a7bc34",25910,"International Gay Information Center collection","","International Gay Information Center",1951,1951,1994,"English","The collection documents the gay liberation movement in New York City and America from the 1950s to the 1980s. Included are records of the Gay Activists Alliance, the Gay Alliance of Brooklyn, Gay Switchboard of New York, the Mattachine Society Inc. of New York, and records of miscellaneous organizations including Christopher Street That New Magazine, Inc., and the periodicals Gaysweek, and New York Native. Personal papers include papers of Lockett Ford Ballard, Jr., Arthur Bell, Billy Wilder Blackwell, Perry Brass, Robert Clement, Don Jackson, Walter Porczak, and Sam Staggs. There are also miscellaneous records of IGIC, including correspondence, minutes, memoranda, photographs of gay rights demonstrations, scripts of plays by gay writers, and printed ephemera issued by gay, lesbian and AIDS organizations in the United States.|||Audiovisual materials include recorded interviews with gay leaders such as Hal (Harold) Call, Curtis Dewees, Franklin Kameny, James Kepner, Morris Kight, Henry (Harry) Hay, Dorr Legg, and Donald Lucas, which chronicle the history of early gay and lesbian organizations such as the Mattachine Society, One, Inc., the Daughters of Bilitis, the Society for Individual Rights, and the Gay Liberation Front. There are also sound recordings of a number of radio and television programs on gay-related issues, most of which were broadcast on Pacifica Radio stations in the early 1980s. These record news and issues of concern to the gay community, such as bias crimes, homophobia, and the spread of AIDS. In addition, the collection includes recordings of lectures, conferences, public forums, and other meetings organized by gay and lesbian groups, some of which include performances by gay entertainers. Most of these gatherings took place in the New York City area in the late 1970s or early 1980s. Audiovisual materials also include television programs (and outtakes) produced in the early 1970s for broadcast on Open Channel, a public access cable channel in New York City. In addition, there are two erotic films, and a documentary entitled, ""A Gay View/Male,"" which was released in 1974.","Biographical or Historical Data Note: The International Gay Information Center, Inc. (IGIC) was founded in New York City in 1982 for the purpose of collecting and preserving historical records and papers which document the movement for gay rights in America. Since its founding the IGIC has collected the records of organizations and the papers of individuals who have been active in the gay rights movement.It has also collected and preserved an extensive file of gay periodicals and imprints; audio-visual materials; and a large mass of printed and near-printed ephemera which document the social and political activities and events of local gay organizations and groups in various cities throughout America. Since its founding John Hammond has served as president, and Bruce Eves as vice-president and treasurer","AIDS (Disease) | Associations, institutions, etc | Gay liberation movement | Homophobia | Gays","","New York (N.Y.)","","","text | still image","Documents | Photographs | Audiotapes | Ephemera","b11686548","","MssCol 2017","","","","","","","208.5 linear feet (135 cartons, 103 boxes). 285 sound recordings, 35 moving images.","","","",1,"http://digitalcollections.nypl.org/collections/3f487530-c602-012f-f6c0-58d385a7bc34"
"6d6a9770-c602-012f-11c6-58d385a7bc34",25962,"Beschryving van Spanjen en Portugal; waar in, op het naauwkeurigste, al het geene, dat, zoo ten opzigte van hunen ouden, als tegenwoordigen staat, aanmerkenswaardig, noodig en vermaakelijk om te weeten is, verhaald en door kunstige print-verbeeldingen en land-kaarten aangeweezen werd; dienende daar-en-boven, voor een kort begrijp der voornaamste geschiedenissen, staatsgevallen, regten, zeden en gewoontens deezer magtige koningrijken ...","","Alvarez de Colmenar, Juan (fl. 1707-1741) | Aa, Pieter van der (1659-1733)","1707",1707,"","","","General Note: Title in red and black ; title vignette.","","","Spain | Portugal","","","","","b13043207","","BXX++ (Álvarez de Colmenar, J. Beschryving van Spanjen en Portugal)","","","","","","17307906","8 p. l., 80, 84, 128, 52, 56, [64] p. illus. (incl. maps,plans) fold. pl., fold. map. 37 cm.","","P. vander Aa","Leyden",1,"http://digitalcollections.nypl.org/collections/6d6a9770-c602-012f-11c6-58d385a7bc34"
"7064c550-c602-012f-79a9-58d385a7bc34",25969,"Woyzeck: Faksimile, Transkription, Emendation und Lesetext","","Büchner, Georg, 1813-1837 | De Angelis, Enrico","2000",1836,"","German","","Statement of Responsibility Note: Georg Büchner ; herausgegeben von Enrico De Angelis.","","","","","","text | still image","Books","b15366833","","JFG 02-569","3598114575","","","","","46487996","289 p. : facsims. ; 31 cm. + 1 computer optical disc (43/4 in.)","Facsimiles","K.G. Saur","München",1,"http://digitalcollections.nypl.org/collections/7064c550-c602-012f-79a9-58d385a7bc34"
